{
  "schema_version": 2,
  "profile": "hermes",
  "primary_adc": "primary",
  "adcs": {
    "primary": {
      "path": "radar_adc.npz",
      "origin": "measurement"
    }
  },
  "motion": {
    "parameters": "amass_sequence.npz"
  },
  "environment": "environment.json",
  "required_features": [
    "channel_map",
    "explicit_tdm_slots"
  ],
  "scene": {
    "file": "environment_geometry/environment_scene.xml"
  }
}
